{
  "_comment": "drupilot KNOWN-GOOD dev-toolchain matrix (the distributed reference lock), one cell per Drupal major family: exact versions installed and verified TOGETHER in a fresh DDEV test-bed (install, the install-toolchain.sh smoke test, run-rector.sh dry-run and apply on real modules, PHPStan and PHPCS). A test-bed uses the cell its installed core major names in config/targets/<major>.json (toolchain_cell); a project lock written by drupilot 0.9 keeps the legacy_v1 set until it is refreshed (install-toolchain.sh --source reference). Only a verified cell is pinned; an unverified one resolves from the config/defaults.json .packages ranges, with a warning. Never edit a version in by hand: only after verifying it the same way (docs/contributing/adr/0001-toolchain-pins.md).",
  "schema_version": 2,
  "cells": {
    "11": {
      "status": "verified",
      "verified": true,
      "src": "docs/contributing/adr/0001-toolchain-pins.md (spike AR-38)",
      "verified_on": {
        "date": "2026-10-04",
        "core": "11.4.8",
        "php": [
          "8.3",
          "8.5"
        ],
        "ddev": "1.25.4"
      },
      "verified_with": [
        "tests/fixtures/legacy_widgets",
        "drupal/autologout 8.x-1.4 (2895b8c1c26d1b9604c87fbc01990866c588ba32)"
      ],
      "toolchain": {
        "palantirnet/drupal-rector": "1.1.3",
        "rector/rector": "2.6.1",
        "phpstan/phpstan": "2.2.16",
        "phpstan/extension-installer": "1.4.3",
        "mglaman/phpstan-drupal": "2.2.2",
        "phpstan/phpstan-deprecation-rules": "2.0.5",
        "drupal/coder": "8.3.31",
        "drush/drush": "13.8.0",
        "drupal/upgrade_status": "4.3.10"
      }
    },
    "12": {
      "status": "verified",
      "verified": true,
      "src": "docs/contributing/adr/0004-d12-bed.md (spike AR-42; re-verified on 12.0.0-beta2, T-M6-02)",
      "verified_on": {
        "date": "2026-10-18",
        "core": "12.0.0-beta2",
        "php": [
          "8.5"
        ],
        "ddev": "1.25.4"
      },
      "verified_with": [
        "tests/fixtures/d11_for_d12",
        "tests/fixtures/legacy_widgets (on 12.0.0-beta1)",
        "drupal/autologout 8.x-1.4 (2895b8c1c26d1b9604c87fbc01990866c588ba32; on 12.0.0-beta1)"
      ],
      "toolchain": {
        "palantirnet/drupal-rector": "1.1.3",
        "rector/rector": "2.6.1",
        "phpstan/phpstan": "2.2.16",
        "phpstan/extension-installer": "1.4.3",
        "mglaman/phpstan-drupal": "2.2.2",
        "phpstan/phpstan-deprecation-rules": "2.0.5",
        "drupal/coder": "9.0.1",
        "drush/drush": null,
        "drupal/upgrade_status": "5.0.0-alpha3"
      },
      "note": "No drush release installs on Drupal 12 (drush 13 needs guzzle ^7; drush 14 is only a dev branch): the bed requires no drush, installs the site with core's install_drupal() and extensions with vendor/bin/dr ex:install. drupal/core is installed from source: its dist export-ignores tests. Composer refuses coder 8.3.31 and phpstan 2.2.2 next to drupal/core-dev 12 (coder ^9.0, phpstan ^2.2.14).",
      "core_install": "source"
    },
    "d7-pre": {
      "status": "planned",
      "verified": false,
      "src": "drupilot 1.0 architecture AR-09 (the Drupal 7 inventory track, M10)",
      "toolchain": {},
      "note": "Defined in M10."
    }
  },
  "phpcompat": {
    "status": "verified",
    "verified": true,
    "src": "docs/contributing/adr/0003-phpcompatibility.md (spike AR-41)",
    "toolchain": {
      "phpcompatibility/php-compatibility": "10.0.0-alpha2",
      "squizlabs/php_codesniffer": "4.0.4",
      "phpcsstandards/phpcsutils": "1.2.3",
      "dealerdirect/phpcodesniffer-composer-installer": "v1.2.1",
      "phpcompatibility/phpcompatibility-symfony": "2.0.0-alpha3",
      "phpcompatibility/phpcompatibility-paragonie": "2.0.0-alpha2",
      "phpcompatibility/phpcompatibility-passwordcompat": "2.0.0-alpha1"
    },
    "note": "Its own Composer tree under <root>/.drupilot/phpcompat (M5), never the test-bed's."
  },
  "_remediation_comment": "The packages printed in the 'by hand' fix command after a failed smoke test or a Rector crash: the ones whose combination breaks Rector.",
  "remediation_packages": [
    "palantirnet/drupal-rector",
    "rector/rector",
    "phpstan/phpstan",
    "mglaman/phpstan-drupal"
  ],
  "known_broken": [
    {
      "packages": {
        "palantirnet/drupal-rector": "0.21.2",
        "rector/rector": ">=2.6.2"
      },
      "symptom": "[ERROR] Could not detect twig set.",
      "cause": "drupal-rector's drupal-10.0-deprecations.php needs TwigSetList::TWIG_24/TWIG_240, which rector 2.6.2 removed. Verified: 2.6.1 works; 2.6.2 and 2.6.7 crash."
    },
    {
      "packages": {
        "palantirnet/drupal-rector": "1.1.2",
        "rector/rector": ">=2.6.2"
      },
      "symptom": "[ERROR] Could not detect twig set.",
      "cause": "Same as 0.21.2; drupal-rector 1.1.3 declares a conflict on rector >=2.6.2 for this reason. Verified with rector 2.6.2."
    },
    {
      "packages": {
        "rector/rector": "2.5.2",
        "phpstan/phpstan": ">=2.2.6"
      },
      "symptom": "MissingPrivatePropertyException: Property \"$container\" was not found in \"PHPStan\\Parser\\RichParser\"",
      "cause": "rector 2.5.2 reads a private PHPStan property that is gone from phpstan 2.2.6 on. Verified: phpstan 2.2.2 and 2.2.5 work; 2.2.6, 2.2.14, 2.2.15 and 2.2.16 crash."
    }
  ],
  "_legacy_v1_comment": "The single set drupilot 0.9 shipped (schema_version 1), kept as it was: a project lock written by 0.9 still installs it, until refreshed.",
  "legacy_v1": {
    "verified_on": "2026-10-02",
    "verified_with": {
      "drupal_core": "11.4.8",
      "php": "8.3",
      "ddev": "1.25.4",
      "subject": "drupal/autologout 8.x-1.4"
    },
    "toolchain": {
      "palantirnet/drupal-rector": "0.21.2",
      "rector/rector": "2.5.2",
      "phpstan/phpstan": "2.2.2",
      "phpstan/extension-installer": "1.4.3",
      "mglaman/phpstan-drupal": "2.2.2",
      "phpstan/phpstan-deprecation-rules": "2.0.5",
      "drupal/coder": "8.3.31",
      "drush/drush": "13.8.0",
      "drupal/upgrade_status": "4.3.10"
    }
  }
}
